{
  "fixture_version": "tempo-cycle-fixtures.v1",
  "status": "spec_fixture_only_not_runtime_implementation",
  "model": {
    "deliberative_content_model": "identity_authored_ideas_only",
    "time_claim_model": "ordinary_truth_claim_with_tempo_claim_metadata",
    "evidence_model": "ordinary_ideas_connected_by_existing_relative_importance_usages",
    "certainty_model": "evidence_placement_and_certainty_band_challenge_verdicts",
    "forbidden_idea_types": [
      "time_claim",
      "tempo_target",
      "beacon",
      "evidence",
      "attestation",
      "testimony",
      "source"
    ],
    "forbidden_time_authority": [
      "node_local_clock",
      "server_time",
      "client_timestamp",
      "receipt_time",
      "block_height",
      "scheduler_observation",
      "local_uncommitted_observation",
      "ai_observation",
      "external_link_alone"
    ]
  },
  "tempo_profile": {
    "profile_id": "tempo_profile_test_v1",
    "test_only": true,
    "Dmin": 2,
    "Dmax": 5,
    "K": 2,
    "certainty_band_order": [
      "none",
      "hypothetical",
      "low",
      "medium",
      "high",
      "beacon"
    ],
    "T_allow": 2,
    "required_human_support_dmin": 1,
    "required_human_margin_dmin": 1,
    "required_human_support_dmax": 1,
    "required_human_margin_dmax": 1,
    "survivor_dmax_min_human_support": 1,
    "structural_support_unit_per_human": 1,
    "passive_evidence_cap": 1,
    "passive_source_dedup_policy": "source_id_target_key_source_epoch",
    "passive_source_class_policy": "shared_upstream_source_class_capped_together",
    "passive_outlier_policy": "test_profile_interval_outlier_rejection_v1",
    "contradiction_block_band": "medium",
    "beacon_minimum_certainty_band": "high",
    "beacon_minimum_distinct_humans": 2,
    "beacon_challenge_survival_cycles": 1,
    "authorization_lag_k": 2,
    "T_contradiction_block": "medium",
    "T_beacon": "high",
    "T_beacon_revoke": "medium",
    "minimum_beacon_identities": 2,
    "minimum_independence_domains": 2,
    "beacon_stability_cycles": 1,
    "tempo_mana_cap": 3,
    "tempo_mana_recharge": 2,
    "time_claim_create_cost": 1,
    "tempo_evidence_claim_create_cost": 1,
    "tempo_evidence_connection_cost": 1,
    "tempo_same_as_connection_cost": 1,
    "time_challenge_cost": 2,
    "structural_dmax_liveness_rule": "single_valid_dmax_truth_claim_no_blockers_for_forced_close_only",
    "constrained_mode_allowlist": [
      "idea_create.truth_claim.tempo_claim",
      "idea_create.truth_claim.tempo_evidence",
      "connection_create.relative_importance.evidence_for",
      "connection_create.relative_importance.evidence_against",
      "connection_create.same_as"
    ],
    "profile_hash": "hash_tempo_profile_test_v1"
  },
  "identities": [
    {
      "identity_id": "id_human_alpha",
      "actor_kind": "human",
      "verification_level": 1,
      "tempo_contributor": true,
      "beacon_qualified_identity": true,
      "independence_domain": "domain_alpha",
      "ordinary_canonical_writer": false,
      "ordinary_challenge_eligible": false
    },
    {
      "identity_id": "id_human_beta",
      "actor_kind": "human",
      "verification_level": 3,
      "tempo_contributor": true,
      "beacon_qualified_identity": true,
      "independence_domain": "domain_beta",
      "ordinary_canonical_writer": true,
      "ordinary_challenge_eligible": true
    },
    {
      "identity_id": "id_human_gamma",
      "actor_kind": "human",
      "verification_level": 2,
      "tempo_contributor": true,
      "beacon_qualified_identity": false,
      "independence_domain": "domain_alpha",
      "ordinary_canonical_writer": true,
      "ordinary_challenge_eligible": true
    },
    {
      "identity_id": "id_ai_delta",
      "actor_kind": "ai",
      "verification_level": 0,
      "tempo_contributor": false,
      "beacon_qualified_identity": false,
      "independence_domain": "none",
      "ordinary_canonical_writer": false,
      "ordinary_challenge_eligible": false
    },
    {
      "identity_id": "id_human_zeta",
      "actor_kind": "human",
      "verification_level": 1,
      "tempo_contributor": false,
      "beacon_qualified_identity": false,
      "independence_domain": "domain_zeta",
      "ordinary_canonical_writer": false,
      "ordinary_challenge_eligible": false
    },
    {
      "identity_id": "system_boundary_emitter",
      "actor_kind": "system_boundary_emitter",
      "verification_level": 0,
      "tempo_contributor": false,
      "beacon_qualified_identity": false,
      "independence_domain": "system",
      "ordinary_canonical_writer": false,
      "ordinary_challenge_eligible": false
    }
  ],
  "genesis": {
    "genesis_event_id": "evt_genesis_0000",
    "initial_cycle_index": 0,
    "initial_authorization_frontier": -1,
    "bootstrap_basis": null,
    "active_tempo_profile_hash": "hash_tempo_profile_test_v1",
    "initial_W_target": 2
  },
  "shared_setup": {
    "cycle0_dmin_target": {
      "target_key": "tempo_target(0, dmin)",
      "cycle_index": 0,
      "anchor_event_id": "evt_genesis_0000",
      "target_kind": "dmin",
      "relation": "elapsed_greater_than_or_equal",
      "duration_value": 2,
      "duration_unit_profile": "test_cycles_elapsed_v1",
      "tempo_profile_hash": "hash_tempo_profile_test_v1"
    },
    "cycle0_dmax_target": {
      "target_key": "tempo_target(0, dmax)",
      "cycle_index": 0,
      "anchor_event_id": "evt_genesis_0000",
      "target_kind": "dmax",
      "relation": "elapsed_greater_than_or_equal",
      "duration_value": 5,
      "duration_unit_profile": "test_cycles_elapsed_v1",
      "tempo_profile_hash": "hash_tempo_profile_test_v1"
    }
  },
  "fixtures": [
    {
      "fixture_id": "TCF-001-valid-target-bound-time-truth-claim",
      "title": "Valid target-bound time truth claim",
      "purpose": "Accept an ordinary truth_claim with valid tempo_claim metadata.",
      "initial_state": {
        "cycle_index": 0,
        "tempo_mana": {
          "id_human_alpha": 3
        }
      },
      "input_events": [
        {
          "event_id": "evt_tcf001_claim",
          "event_type": "idea_create",
          "author_identity_id": "id_human_alpha",
          "payload": {
            "idea_id": "claim_tcf001_dmin_alpha",
            "idea_type": "truth_claim",
            "truth_subtype": "observation_or_measurement",
            "tempo_claim": {
              "target_key": "tempo_target(0, dmin)",
              "anchor_event_id": "evt_genesis_0000",
              "anchor_cycle_index": 0,
              "target_kind": "dmin",
              "relation": "elapsed_greater_than_or_equal",
              "duration_value": 2,
              "duration_unit_profile": "test_cycles_elapsed_v1",
              "tempo_profile_hash": "hash_tempo_profile_test_v1",
              "asserted_value": true,
              "provenance_refs": []
            },
            "tempo_lane": {
              "tempo_lane_operation": "target_time_claim_create",
              "tempo_mana_spend": 1,
              "tempo_profile_hash": "hash_tempo_profile_test_v1"
            }
          }
        }
      ],
      "harness_actions": [],
      "expected_acceptance": [
        "evt_tcf001_claim"
      ],
      "expected_rejections": [],
      "expected_derived_outputs": {
        "created_idea_type": "truth_claim",
        "target_key": "tempo_target(0, dmin)",
        "operative_certainty_band": "none",
        "forbidden_idea_types_created": []
      },
      "expected_cycle_outputs": {},
      "expected_authorization_outputs": {
        "authorization_frontier": -1,
        "consequential_authority": false
      },
      "notes": [
        "Creation alone carries no certainty or authority."
      ]
    },
    {
      "fixture_id": "TCF-002-rejected-unrelated-idea-through-tempo-lane",
      "title": "Rejected unrelated idea through narrow Tempo lane",
      "purpose": "Reject low-threshold attempts to create unrelated content through the Tempo lane.",
      "initial_state": {
        "cycle_index": 0,
        "tempo_mana": {
          "id_human_alpha": 3
        }
      },
      "input_events": [
        {
          "event_id": "evt_tcf002_unrelated_truth",
          "event_type": "idea_create",
          "author_identity_id": "id_human_alpha",
          "payload": {
            "idea_id": "claim_tcf002_unrelated",
            "idea_type": "truth_claim",
            "truth_subtype": "relation_or_pattern",
            "tempo_lane": {
              "tempo_lane_operation": "target_time_claim_create",
              "tempo_mana_spend": 1,
              "tempo_profile_hash": "hash_tempo_profile_test_v1"
            }
          }
        },
        {
          "event_id": "evt_tcf002_concept",
          "event_type": "idea_create",
          "author_identity_id": "id_human_alpha",
          "payload": {
            "idea_id": "idea_tcf002_concept",
            "idea_type": "conceptual_idea",
            "tempo_lane": {
              "tempo_lane_operation": "target_time_claim_create",
              "tempo_mana_spend": 1,
              "tempo_profile_hash": "hash_tempo_profile_test_v1"
            }
          }
        }
      ],
      "harness_actions": [],
      "expected_acceptance": [],
      "expected_rejections": [
        {
          "event_id": "evt_tcf002_unrelated_truth",
          "code": "ERR_TEMPO_CLAIM_MISSING_METADATA",
          "code_status": "appendix_a_final"
        },
        {
          "event_id": "evt_tcf002_concept",
          "code": "ERR_TEMPO_CLAIM_NOT_TRUTH_CLAIM",
          "code_status": "appendix_a_final"
        }
      ],
      "expected_derived_outputs": {
        "tempo_mana_spent": 0
      },
      "expected_cycle_outputs": {},
      "expected_authorization_outputs": {},
      "notes": [
        "Invalid events do not spend Tempo mana."
      ]
    },
    {
      "fixture_id": "TCF-003-two-equivalent-target-bound-time-claims",